number,value,datetime_start,datetime_complete,duration,params_bagging_temperature,params_bootstrap_type,params_border_count,params_cw_blue,params_cw_green,params_cw_orange,params_cw_red,params_depth,params_grow_policy,params_iterations,params_l2_leaf_reg,params_leaf_estimation_iterations,params_leaf_estimation_method,params_learning_rate,params_max_leaves,params_min_data_in_leaf,params_random_strength,params_rsm,params_subsample,state
129,0.8645884939574892,2026-05-20 16:29:24.397993,2026-05-20 16:30:14.576099,0 days 00:00:50.178106,,MVS,184,5.961753861925712,2.3301864218798074,1.2709350826356,11.746315907477385,10,SymmetricTree,3200,0.22098079466647888,10,Newton,0.23459993104993904,,,0.2693450177292499,0.8198888020524279,0.6710703274083222,COMPLETE
130,0.8518410906382498,2026-05-20 16:30:14.736259,2026-05-20 16:33:14.490682,0 days 00:02:59.754423,,MVS,210,2.1397608548810623,2.694578360245696,1.1077350521395515,3.233440330945902,10,SymmetricTree,3400,4.334456081718336e-05,7,Newton,0.03491161237650432,,,0.8490196619739279,0.8263343586851665,0.6414866556516818,COMPLETE
131,0.871612391570841,2026-05-20 16:33:14.808092,2026-05-20 16:34:07.447375,0 days 00:00:52.639283,,MVS,152,4.953353689181229,2.3258528237764353,1.5565641687951242,2.7365826156275532,8,Lossguide,3200,0.008172001671969886,10,Newton,0.10523048818222806,123.0,17.0,0.2147855048076758,0.9312029278530273,0.6227004805886657,COMPLETE
132,0.855233788302637,2026-05-20 16:34:07.615991,2026-05-20 16:35:01.328946,0 days 00:00:53.712955,,MVS,162,3.777222134480274,3.1110023200547414,4.145009846968812,5.512169812496783,7,Lossguide,3500,0.04388395227207336,9,Newton,0.12216184446428643,131.0,27.0,0.4146353801752677,0.9995968307054277,0.6625847181652574,COMPLETE
133,0.8431028450727028,2026-05-20 16:35:01.498966,2026-05-20 16:37:33.874838,0 days 00:02:32.375872,,MVS,166,3.0278422451295315,0.5681503018027139,4.062133881511905,9.070474812387793,9,Lossguide,3400,0.0038918346629944482,10,Newton,0.05159946284205765,127.0,16.0,0.02250312783285035,0.9812279907738926,0.6347936543069146,COMPLETE
134,0.8552282826170625,2026-05-20 16:37:34.139068,2026-05-20 16:37:51.794578,0 days 00:00:17.655510,6.229784398451466,Bayesian,134,3.8523160172686683,1.331976940527194,1.397102036926848,5.7309076193713375,9,Depthwise,3100,0.0018514807163709816,8,Newton,0.2721222501973319,,14.0,0.01841709040689974,0.9895235732611642,,COMPLETE
135,0.8684471458415188,2026-05-20 16:37:52.046728,2026-05-20 16:39:29.160556,0 days 00:01:37.113828,,Bernoulli,142,4.086838047195485,1.9963315346609611,1.297117207554296,22.465250108871928,10,SymmetricTree,3700,2.162678760130854e-08,9,Gradient,0.28060583264456135,,,0.002615129296318386,0.8297410190666483,0.62476806000149,COMPLETE
136,0.8630435522575219,2026-05-20 16:39:29.430138,2026-05-20 16:41:13.723522,0 days 00:01:44.293384,,MVS,180,2.3675131842776187,1.3042578385402175,1.5687878783119111,18.96907363421487,10,SymmetricTree,3400,2.6867562637172397e-08,9,Gradient,0.08791570499788286,,,0.4030477578517652,0.8480287137446905,0.682318941719183,COMPLETE
137,0.865755043530628,2026-05-20 16:41:13.884950,2026-05-20 16:42:34.201667,0 days 00:01:20.316717,,Bernoulli,100,4.739598017603235,1.8158664766650334,1.012369698975415,18.425314911586042,9,SymmetricTree,4100,1.5964239916250627e-07,9,Gradient,0.1363364666715238,,,0.25886769029814394,0.8226479977715944,0.6264786687271306,COMPLETE
138,0.869778828425131,2026-05-20 16:42:34.375497,2026-05-20 16:43:18.668618,0 days 00:00:44.293121,,MVS,144,3.336761703836413,1.9465905510451356,1.5988023982015669,7.797807653781552,8,SymmetricTree,4500,0.11721588164734249,6,Newton,0.16256985050069897,,,1.154009030030578,0.9648315281554091,0.7503699321284354,COMPLETE
139,0.8703992762898393,2026-05-20 16:43:18.838202,2026-05-20 16:44:00.400433,0 days 00:00:41.562231,,MVS,136,2.5964716892422173,2.054170737171175,1.7010761102286271,6.627221289584215,9,SymmetricTree,3400,0.09538248367262257,6,Newton,0.1445005638066297,,,4.95635212581346,0.9804081152037174,0.7816941503947139,COMPLETE
140,0.8561119879391852,2026-05-20 16:44:00.573724,2026-05-20 16:45:02.358519,0 days 00:01:01.784795,,MVS,136,2.819886420781764,0.7375843011550833,3.3138940224485456,2.9164310389912593,9,SymmetricTree,3000,1.619473602299809,5,Newton,0.12265389159482795,,,2.831821337114861,0.9670006559325836,0.8003945024439274,COMPLETE
141,0.8684128471389903,2026-05-20 16:45:02.531063,2026-05-20 16:46:57.144927,0 days 00:01:54.613864,,MVS,160,4.406038532122114,2.2270953654386703,1.4105066079500073,9.889498278439586,7,SymmetricTree,4700,0.10899256280979036,8,Newton,0.08223669681335857,,,0.4912259523930193,0.9811837631155021,0.7947979349061753,COMPLETE
142,0.8583767631058136,2026-05-20 16:46:57.423900,2026-05-20 16:48:30.382070,0 days 00:01:32.958170,,MVS,94,1.7941743104519148,1.5421112599368643,2.3026107697936964,16.873996912138246,8,SymmetricTree,5000,0.033783123038113774,6,Newton,0.09042379369703107,,,6.595213608278169,0.905916197481542,0.8118332986200073,COMPLETE
143,0.8724208579457304,2026-05-20 16:48:30.547812,2026-05-20 16:49:22.269182,0 days 00:00:51.721370,,Bernoulli,136,6.202535757725311,1.5492417727815786,1.257415149720097,4.34103558347997,9,SymmetricTree,3800,3.225068912765531,8,Newton,0.22234256540093222,,,0.00021430008045166294,0.9968223885876827,0.7846524782032283,COMPLETE
144,0.8595369879231205,2026-05-20 16:49:22.442124,2026-05-20 16:50:10.166903,0 days 00:00:47.724779,,Bernoulli,112,5.790903298521181,1.419952639538093,3.0030152978823805,3.63417577050443,9,SymmetricTree,2400,0.011466985202005195,5,Newton,0.09391478386415891,,,0.00019392592206040994,0.9306052631924394,0.7947652953831552,COMPLETE
145,0.861325074331732,2026-05-20 16:50:10.335568,2026-05-20 16:51:12.362058,0 days 00:01:02.026490,,MVS,108,2.958723871667881,2.963214747613735,3.0949828068345515,8.361962682624208,9,SymmetricTree,3800,0.3071721605960637,7,Newton,0.11579233843379536,,,0.01734477417906886,0.9285273951961276,0.7787831224859143,COMPLETE
146,0.8739420239758683,2026-05-20 16:51:12.533093,2026-05-20 16:52:15.565807,0 days 00:01:03.032714,,Bernoulli,194,5.98653984122885,2.516471658758509,1.1342392351200266,4.819207872571906,9,SymmetricTree,3900,6.0859848190537695,7,Newton,0.18736106977628356,,,6.647894903395544e-07,0.9908621604872192,0.7756887924052613,COMPLETE
147,0.8687793953763695,2026-05-20 16:52:15.737373,2026-05-20 16:53:28.048273,0 days 00:01:12.310900,,Bernoulli,178,5.49155871156105,2.9279681676424136,1.0065714323790236,8.602520625771167,8,SymmetricTree,3500,0.3297931500661585,7,Newton,0.1538028562035326,,,5.7408415275330525e-08,0.9505134761464032,0.7625023270921865,COMPLETE
148,0.8709917114943908,2026-05-20 16:53:28.221453,2026-05-20 16:54:42.834175,0 days 00:01:14.612722,2.47849516705902,Bayesian,222,5.7774199288009385,3.246457418617894,1.3175506770194225,7.085189615577606,9,SymmetricTree,4300,28.437027001312448,6,Newton,0.2804080942240667,,,3.888207376382815e-08,0.9667176356142294,,COMPLETE
149,0.8699656915337147,2026-05-20 16:54:42.988049,2026-05-20 16:57:04.639900,0 days 00:02:21.651851,2.384964207106205,Bayesian,242,4.174454754887302,3.3201223395816677,1.5492327588805406,12.319595677812488,9,SymmetricTree,4400,22.549801927443397,3,Newton,0.13571300431430003,,,6.00011959015759e-08,0.8633549772834848,,COMPLETE
150,0.8624174310095747,2026-05-20 16:57:04.966249,2026-05-20 16:57:42.649016,0 days 00:00:37.682767,2.3739581202424964,Bayesian,230,5.6066636174364595,2.544554093842383,2.6310158829625117,6.011101747442789,10,SymmetricTree,3700,1.3135760333091544,4,Newton,0.25107229627927596,,,7.832301464382043e-05,0.9991663310354962,,COMPLETE
151,0.8721773427661119,2026-05-20 16:57:42.823646,2026-05-20 17:00:52.757684,0 days 00:03:09.934038,,MVS,60,0.8965176571910685,4.703539836237747,1.0212994465093086,3.827004124150352,10,Lossguide,3900,4.98144103969245e-07,10,Gradient,0.03656945190181181,169.0,34.0,0.593755210067944,0.5559476753444926,0.7845363290563273,COMPLETE
152,0.8557877861223379,2026-05-20 17:00:52.930938,2026-05-20 17:03:31.279447,0 days 00:02:38.348509,2.452740918396514,Bayesian,68,2.770497447542727,4.802869495568972,3.7770346050461017,4.986481289390877,10,Lossguide,4300,4.980506216464899e-08,9,Gradient,0.03282785547948247,181.0,47.0,0.07187836437884787,0.7615275069469383,,COMPLETE
153,,2026-05-20 17:03:31.454518,2026-05-20 17:05:11.006544,0 days 00:01:39.552026,,MVS,56,1.457877348472207,4.288537189342607,2.249210351104091,10.190201980016873,10,Lossguide,4600,3.4235058003742604e-06,8,Gradient,0.11580519718052343,168.0,43.0,0.7983097576604806,0.509054962526195,0.7697195021248703,FAIL
